{
  "schemaVersion": "ui-visual-manifest.v1",
  "manifestId": "todo-all-routes-and-primary-states",
  "thresholdPolicyRef": "todo-visual-threshold.policy.json",
  "cases": [
    { "id": "active-list-mobile", "routePath": "/todos", "viewport": { "width": 375, "height": 800 }, "ready": { "kind": "role", "role": "heading", "name": "TODO管理" }, "intercepts": [], "actions": [], "screenshotName": "active-list-mobile.png" },
    { "id": "active-list-desktop", "routePath": "/todos", "viewport": { "width": 1280, "height": 900 }, "ready": { "kind": "role", "role": "heading", "name": "TODO管理" }, "intercepts": [], "actions": [], "screenshotName": "active-list-desktop.png" },
    { "id": "create-mobile", "routePath": "/todos/new", "viewport": { "width": 375, "height": 800 }, "ready": { "kind": "role", "role": "dialog", "name": "新しいTODO" }, "intercepts": [], "actions": [{ "type": "expectText", "value": "品質ハーネスの最小チェックを通す" }], "screenshotName": "create-mobile.png" },
    { "id": "create-desktop", "routePath": "/todos/new", "viewport": { "width": 1280, "height": 900 }, "ready": { "kind": "role", "role": "dialog", "name": "新しいTODO" }, "intercepts": [], "actions": [{ "type": "expectText", "value": "品質ハーネスの最小チェックを通す" }], "screenshotName": "create-desktop.png" },
    { "id": "completed-list-mobile", "routePath": "/todos/completed", "viewport": { "width": 375, "height": 800 }, "ready": { "kind": "role", "role": "link", "name": "未完了を見る" }, "intercepts": [], "actions": [], "screenshotName": "completed-list-mobile.png" },
    { "id": "completed-list-desktop", "routePath": "/todos/completed", "viewport": { "width": 1280, "height": 900 }, "ready": { "kind": "role", "role": "link", "name": "未完了を見る" }, "intercepts": [], "actions": [], "screenshotName": "completed-list-desktop.png" },
    { "id": "active-detail-mobile", "routePath": "/todos/todo-001", "viewport": { "width": 375, "height": 800 }, "ready": { "kind": "role", "role": "heading", "name": "品質ハーネスの最小チェックを通す" }, "intercepts": [], "actions": [], "screenshotName": "active-detail-mobile.png" },
    { "id": "active-detail-desktop", "routePath": "/todos/todo-001", "viewport": { "width": 1280, "height": 900 }, "ready": { "kind": "role", "role": "heading", "name": "品質ハーネスの最小チェックを通す" }, "intercepts": [], "actions": [], "screenshotName": "active-detail-desktop.png" },
    { "id": "active-edit-mobile", "routePath": "/todos/todo-001/edit", "viewport": { "width": 375, "height": 800 }, "ready": { "kind": "role", "role": "dialog", "name": "TODOを編集" }, "intercepts": [], "actions": [], "screenshotName": "active-edit-mobile.png" },
    { "id": "active-edit-desktop", "routePath": "/todos/todo-001/edit", "viewport": { "width": 1280, "height": 900 }, "ready": { "kind": "role", "role": "dialog", "name": "TODOを編集" }, "intercepts": [], "actions": [], "screenshotName": "active-edit-desktop.png" },
    { "id": "completed-detail-mobile", "routePath": "/todos/completed/todo-007", "viewport": { "width": 375, "height": 800 }, "ready": { "kind": "role", "role": "heading", "name": "ねこ用のメモを整理する" }, "intercepts": [], "actions": [], "screenshotName": "completed-detail-mobile.png" },
    { "id": "completed-detail-desktop", "routePath": "/todos/completed/todo-007", "viewport": { "width": 1280, "height": 900 }, "ready": { "kind": "role", "role": "heading", "name": "ねこ用のメモを整理する" }, "intercepts": [], "actions": [], "screenshotName": "completed-detail-desktop.png" },
    { "id": "completed-edit-mobile", "routePath": "/todos/completed/todo-007/edit", "viewport": { "width": 375, "height": 800 }, "ready": { "kind": "role", "role": "heading", "name": "TODO管理" }, "intercepts": [], "actions": [], "screenshotName": "completed-edit-mobile.png" },
    { "id": "completed-edit-desktop", "routePath": "/todos/completed/todo-007/edit", "viewport": { "width": 1280, "height": 900 }, "ready": { "kind": "role", "role": "heading", "name": "TODO管理" }, "intercepts": [], "actions": [], "screenshotName": "completed-edit-desktop.png" },
    { "id": "empty-mobile", "routePath": "/todos", "viewport": { "width": 375, "height": 800 }, "ready": { "kind": "role", "role": "heading", "name": "TODO管理" }, "intercepts": [], "actions": [{ "type": "fill", "locator": { "kind": "role", "role": "textbox", "name": "検索" }, "value": "__no_match__" }, { "type": "expectText", "value": "表示できるTODOがありません" }], "screenshotName": "empty-mobile.png" },
    { "id": "loading-mobile", "routePath": "/todos", "viewport": { "width": 375, "height": 800 }, "ready": { "kind": "text", "name": "読み込み中" }, "intercepts": [{ "urlPattern": "**/api/todos", "method": "GET", "delayMs": 1500 }], "actions": [], "screenshotName": "loading-mobile.png" },
    { "id": "error-mobile", "routePath": "/todos", "viewport": { "width": 375, "height": 800 }, "ready": { "kind": "text", "name": "取得できませんでした" }, "intercepts": [{ "urlPattern": "**/api/todos", "method": "GET", "status": 503, "body": "一時的に取得できません。" }], "actions": [], "screenshotName": "error-mobile.png" },
    { "id": "disabled-create-mobile", "routePath": "/todos/new", "viewport": { "width": 375, "height": 800 }, "ready": { "kind": "role", "role": "button", "name": "追加する", "disabled": true }, "intercepts": [], "actions": [{ "type": "expectText", "value": "品質ハーネスの最小チェックを通す" }], "screenshotName": "disabled-create-mobile.png" },
    { "id": "empty-desktop", "routePath": "/todos", "viewport": { "width": 1280, "height": 900 }, "ready": { "kind": "role", "role": "heading", "name": "TODO管理" }, "intercepts": [], "actions": [{ "type": "fill", "locator": { "kind": "role", "role": "textbox", "name": "検索" }, "value": "__no_match__" }, { "type": "expectText", "value": "表示できるTODOがありません" }], "screenshotName": "empty-desktop.png" },
    { "id": "loading-desktop", "routePath": "/todos", "viewport": { "width": 1280, "height": 900 }, "ready": { "kind": "text", "name": "読み込み中" }, "intercepts": [{ "urlPattern": "**/api/todos", "method": "GET", "delayMs": 1500 }], "actions": [], "screenshotName": "loading-desktop.png" },
    { "id": "error-desktop", "routePath": "/todos", "viewport": { "width": 1280, "height": 900 }, "ready": { "kind": "text", "name": "取得できませんでした" }, "intercepts": [{ "urlPattern": "**/api/todos", "method": "GET", "status": 503, "body": "一時的に取得できません。" }], "actions": [], "screenshotName": "error-desktop.png" },
    { "id": "disabled-create-desktop", "routePath": "/todos/new", "viewport": { "width": 1280, "height": 900 }, "ready": { "kind": "role", "role": "button", "name": "追加する", "disabled": true }, "intercepts": [], "actions": [{ "type": "expectText", "value": "品質ハーネスの最小チェックを通す" }], "screenshotName": "disabled-create-desktop.png" }
  ]
}
